review,rating,summary
"Great product, very fast delivery and works perfectly!",5.0 out of 5 stars,"The reviewer reports a positive experience with the product, mentioning fast delivery and proper functioning."
"Average quality, expected better for the price paid.",3.0 out of 5 stars,"The product received an average rating, failing to meet expectations for its cost."
Stopped working after 2 weeks. Very disappointed with quality.,1.0 out of 5 stars,The reviewer is extremely dissatisfied with the product due to it breaking after only 2 weeks of use.
Absolutely love it! Best purchase I made this year.,5.0 out of 5 stars,"The reviewer thoroughly enjoys the product, calling it their best purchase of the year."
Decent product but packaging was damaged on arrival.,3.0 out of 5 stars,"The product is decent, but it arrived with damaged packaging."
